{
  "schema_version": "father-osint.transform.v0.1",
  "transform_id": "TRN-SYNTH-REGISTRY-LOOKUP",
  "name": "Synthetic registry organization lookup",
  "version": "0.1.0",
  "input_entity_types": ["ORGANIZATION"],
  "output_object_types": ["ORGANIZATION","ADDRESS","SOURCE_CAPTURE","CLAIM","RELATION","SEARCH_JOURNAL"],
  "source_id": "SRC-0001",
  "required_credentials": "NONE",
  "legal_scope": {"allowed_case_types":["SYNTHETIC_TRAINING"],"allowed_access_classes":["PUBLIC"],"passive_only":true,"terms_note":"Local synthetic fixture; no external service terms apply."},
  "rate_limit": {"max_requests":0,"per_seconds":1,"concurrency":1},
  "parser_version": "synthetic-registry-parser/0.1",
  "evidence_capture_mode": "FULL_CAPTURE",
  "execution_profile": "FIXTURE_ONLY",
  "safety_class": "PASSIVE_PUBLIC",
  "network_policy": "NO_NETWORK",
  "tool_adapter_id": null,
  "output_contract": "father-osint.entities-relations-sources.v0.1",
  "requires_human_approval": false,
  "enabled": true,
  "health": "HEALTHY",
  "version_probe": null,
  "synthetic": true
}
